{
    "filter": {
        "building": [
            "apartments",
            "bungalow",
            "detached",
            "dormitory",
            "hotel",
            "residential",
            "semidetached_house",
            "terrace",
            "commercial",
            "retail",
            "supermarket",
            "industrial",
            "office",
            "warehouse",
            "bakehouse",
            "firestation",
            "government",
            "cathedral",
            "chapel",
            "church",
            "mosque",
            "religous",
            "shrine",
            "synagogue",
            "temple",
            "hospital",
            "kindergarden",
            "school",
            "university",
            "college",
            "sports_hall",
            "stadium",
            "yes"
        ]
    },

    "object_features": ["units", "levels", "area", "floor_area"],

    "distance_to_nearest": ["transit"],

    "default_tags": [["building", "residential"]],

    "activity_mapping": {
        "building": {
            "apartments": ["home"],
            "bungalow": ["home"],
            "detached": ["home"],
            "dormitory": ["home"],
            "hotel": ["home"],
            "residential": ["home"],
            "semidetached_house": ["home"],
            "terrace": ["home"],
            "commercial": ["shop", "work", "delivery"],
            "retail": ["shop", "work", "delivery"],
            "supermarket": ["shop_food", "work", "delivery"],
            "industrial": ["work", "delivery"],
            "office": ["work", "delivery"],
            "warehouse": ["work", "depot", "delivery"],
            "bakehouse": ["work", "depot", "delivery"],
            "firestation": ["work"],
            "government": ["work"],
            "cathedral": ["religous"],
            "chapel": ["religous"],
            "church": ["religous"],
            "mosque": ["religous"],
            "religous": ["religous"],
            "shrine": ["religous"],
            "synagogue": ["religous"],
            "temple": ["religous"],
            "hospital": ["health", "work"],
            "kindergarden": ["education", "work"],
            "school": ["education", "work"],
            "university": ["education", "work"],
            "college": ["education", "work"],
            "sports_hall": ["leisure", "work"],
            "stadium": ["leisure", "work"]
        },
        "amenity": {
            "bar": ["social", "work", "delivery"],
            "pub": ["social", "work", "delivery"],
            "cafe": ["social", "work", "delivery", "food_shop"],
            "fast_food": ["work", "delivery", "food_shop"],
            "food_court": ["work", "delivery", "food_shop"],
            "ice_cream": ["work", "delivery", "food_shop"],
            "restaurant": ["work", "delivery", "food_shop"],
            "college": ["education", "work"],
            "kindergarten": ["education", "work"],
            "language_school": ["education", "work"],
            "library": ["leisure", "work"],
            "music_school": ["leisure", "work"],
            "school": ["leisure", "work"],
            "university": ["leisure", "work"],
            "bank": ["personal_business", "work"],
            "clinic": ["health", "work"],
            "dentist": ["health", "work"],
            "doctors": ["health", "work"],
            "hospital": ["health", "work"],
            "pharmacy": ["shop", "work"],
            "social_facility": ["health", "work"],
            "vetinary": ["personal_business", "work"],
            "arts_centre": ["leisure", "work"],
            "casino": ["leisure", "work"],
            "cinema": ["leisure", "work"],
            "community_centre": ["leisure"],
            "gambling": ["leisure", "work"],
            "studio": ["leisure", "work"],
            "theatre": ["leisure", "work"],
            "courthouse": ["personal_business", "work"],
            "crematorium": ["personal_business", "work"],
            "embassy": ["personal_business", "work"],
            "fire_station": ["work"],
            "funeral_hall": ["personal_business", "work"],
            "internet_cafe": ["leisure", "work"],
            "marketplace": ["shop_food", "work", "delivery"],
            "place_of_worship": ["religous"],
            "police": ["personal_business", "work"],
            "post_box": ["personal_business", "work"],
            "post_depot": ["personal_business", "work"],
            "post_office": ["personal_business", "work"],
            "prison": ["personal_business", "work"],
            "townhall": ["personal_business", "work"]
        },
        "landuse": {
            "commercial": ["shop", "work", "delivery"],
            "industrial": ["shop", "work", "delivery", "depot"],
            "residential": ["home"],
            "retail": ["shop", "work", "delivery"],
            "depot": ["depot"],
            "port": ["depot"],
            "quary": ["depot"],
            "religous": ["religous"]
        },
        "leisure": {
            "adult_gaming_centre": ["leisure", "work"],
            "amusement_arcade": ["leisure", "work"],
            "beach_resort": ["leisure"],
            "dance": ["leisure", "work"],
            "escape_game": ["leisure", "work"],
            "fishing": ["leisure"],
            "fitness_centre": ["leisure", "work"],
            "fitness_station": ["leisure"],
            "garden": ["leisure"],
            "horse_riding": ["leisure", "work"],
            "ice_rink": ["leisure", "work"],
            "marina": ["leisure", "work"],
            "miniature_golf": ["leisure"],
            "nature_reserve": ["leisure"],
            "park": ["leisure"],
            "pitch": ["leisure"],
            "playground": ["leisure"],
            "sports_centre": ["leisure", "work"],
            "stadium": ["leisure", "work"],
            "swimming_pool": ["leisure", "work"],
            "track": ["leisure"],
            "water_park": ["leisure", "work"]
        },
        "office": {
            "*": ["work"]
        },
		"public_transport": {
			"*": ["transit"]
		},
		"highway": {
			"bus_stop": ["transit"]
		}
    },

	"fill_missing_activities":
    [
        {
            "area_tags": [["landuse", "residential"]],
            "required_acts": ["home"],
            "new_tags": [["building", "house"]],
            "fill_method": "spacing",
            "size": [10, 10],
            "spacing": [50, 50]
        }

    ]
}