{
    "filter": {
        "leisure": ["pitch", "park", "playground"]
    },

    "object_features": ["units", "levels", "area", "floor_area"],

    "default_tags": [["building", "residential"]],

    "activity_mapping": {
        "leisure": {
            "park": ["leisure"],
            "playground": ["leisure"],
            "pitch": ["leisure"]
        }
    }
}