{
	"filter": {
		"building": [
			"apartments",
			"bungalow",
			"detached",
			"dormitory",
			"hotel",
			"house",
			"residential",
			"semidetached_house",
			"terrace",
			"commercial",
			"retail",
			"supermarket",
			"industrial",
			"office",
			"warehouse",
			"bakehouse",
			"firestation",
			"government",
			"cathedral",
			"chapel",
			"church",
			"mosque",
			"other",
			"shrine",
			"synagogue",
			"temple",
			"hospital",
			"kindergarden",
			"school",
			"university",
			"college",
			"sports_hall",
			"stadium",
			"yes"
		],
		"public_transport": ["*"],
		"highway": ["bus_stop"]
	},

	"object_features": ["units", "levels", "area", "floor_area"],

	"distance_to_nearest": ["transit"],

	"fill_missing_activities":
		[
			{
				"area_tags": [["landuse", "residential"]],
				"required_acts": ["home"],
				"new_tags": [["building", "house"]],
				"size": [10, 10],
				"spacing": [25, 50]
			}

		],

	"default_tags": [["building", "residential"]],

	"activity_mapping": {
		"public_transport": {
			"*": ["transit"]
		},
		"highway": {
			"bus_stop": ["transit"]
		},
		"building": {
			"apartments": ["home"],
			"bungalow": ["home"],
			"detached": ["home"],
			"dormitory": ["home"],
			"hotel": ["home"],
			"house": ["home"],
			"residential": ["home"],
			"semidetached_house": ["home"],
			"terrace": ["home"],
			"commercial": ["shop", "work"],
			"retail": ["shop", "work"],
			"supermarket": ["shop", "work"],
			"industrial": ["work"],
			"office": ["work"],
			"warehouse": ["work"],
			"bakehouse": ["work"],
			"firestation": ["work"],
			"government": ["work"],
			"cathedral": ["other"],
			"chapel": ["other"],
			"church": ["other"],
			"mosque": ["other"],
			"other": ["other"],
			"shrine": ["other"],
			"synagogue": ["other"],
			"temple": ["other"],
			"hospital": ["medical", "work"],
			"kindergarden": ["education", "work"],
			"school": ["education", "work"],
			"university": ["education", "work"],
			"college": ["education", "work"],
			"sports_hall": ["other", "work"],
			"stadium": ["other", "work"]
		},
		"amenity": {
			"bar": ["visit", "work"],
			"pub": ["visit", "work"],
			"cafe": ["visit", "work", "shop"],
			"fast_food": ["work", "shop"],
			"food_court": ["work", "shop"],
			"ice_cream": ["work", "shop"],
			"restaurant": ["work", "shop"],
			"college": ["education", "work"],
			"kindergarten": ["education", "work"],
			"language_school": ["education", "work"],
			"library": ["other", "work"],
			"music_school": ["education", "work"],
			"school": ["education", "work"],
			"university": ["education", "work"],
			"bank": ["other", "work"],
			"clinic": ["medical", "work"],
			"dentist": ["medical", "work"],
			"doctors": ["medical", "work"],
			"hospital": ["medical", "work"],
			"pharmacy": ["shop", "work"],
			"visit_facility": ["medical", "work"],
			"vetinary": ["other", "work"],
			"arts_centre": ["other", "work"],
			"casino": ["other", "work"],
			"cinema": ["other", "work"],
			"community_centre": ["other"],
			"gambling": ["other", "work"],
			"studio": ["other", "work"],
			"theatre": ["other", "work"],
			"courthouse": ["other", "work"],
			"crematorium": ["other", "work"],
			"embassy": ["other", "work"],
			"fire_station": ["work"],
			"funeral_hall": ["other", "work"],
			"internet_cafe": ["other", "work"],
			"marketplace": ["shop", "work"],
			"place_of_worship": ["other"],
			"police": ["other", "work"],
			"post_box": ["other", "work"],
			"post_work": ["other", "work"],
			"post_office": ["other", "work"],
			"prison": ["other", "work"],
			"townhall": ["other", "work"]
		},
		"healthcare": {
			"*": ["medical", "work"]
		},
		"landuse": {
			"commercial": ["shop", "work"],
			"industrial": ["work"],
			"residential": ["home"],
			"retail": ["shop", "work"],
			"work": ["work"],
			"port": ["work"],
			"quary": ["work"],
			"other": ["other"]
		},
		"other": {
			"adult_gaming_centre": ["other", "work"],
			"amusement_arcade": ["other", "work"],
			"beach_resort": ["other"],
			"dance": ["other", "work"],
			"escape_game": ["other", "work"],
			"fishing": ["other"],
			"fitness_centre": ["other", "work"],
			"fitness_station": ["other"],
			"garden": ["other"],
			"horse_riding": ["other", "work"],
			"ice_rink": ["other", "work"],
			"marina": ["other", "work"],
			"miniature_golf": ["other"],
			"nature_reserve": ["other"],
			"park": ["other"],
			"pitch": ["other"],
			"playground": ["other"],
			"sports_centre": ["other", "work"],
			"stadium": ["other", "work"],
			"swimming_pool": ["other", "work"],
			"track": ["other"],
			"water_park": ["other", "work"]
		},
	"office": {
			"*": ["work"]
	},
	"shop": {
			"*": ["shop", "work"]
		}
	}
}
